{
  "$schema": "./docs/feature.schema.json",
  "project": "finsage_ai",
  "version": "1.0.0",
  "generated_at": "2026-08-09",
  "plan_ref": "docs/IMPLEMENTATION_PLAN.md",
  "review_ref": "CODE_REVIEW_2026-08.md",
  "fy_supported": [
    "2024-25",
    "2025-26",
    "2026-27"
  ],
  "governing_act": "Income-tax Act, 2025 (in force 2026-04-01); Income-tax Act, 1961 for FY <= 2025-26",
  "conventions": {
    "status_vocabulary": [
      "not_started",
      "in_progress",
      "blocked",
      "implemented",
      "tested",
      "verified"
    ],
    "status_notes": "Only 'verified' (legal basis confirmed against an official source) counts toward completion. Nothing user-facing ships below 'verified'.",
    "tier": {
      "P0": "Correctness or safety. Blocks release.",
      "P1": "Core user value.",
      "P2": "Differentiating value.",
      "P3": "Nice to have."
    },
    "freshness_policy_days": 180,
    "freshness_note": "CI job verify_freshness.py FAILS the build when any feature with rules_refs has last_verified older than freshness_policy_days.",
    "invariants": [
      "No feature may be both deterministic:true and llm_involved:true in its calculation path.",
      "Every feature with a user-facing rupee figure must list at least one golden test.",
      "Every feature with rules_refs must have at least one Tier-1 official source."
    ]
  },
  "phases": [
    {
      "id": 0,
      "name": "Foundation & guardrails",
      "gate": "CI green on empty suite; core boundary rule enforced",
      "status": "verified"
    },
    {
      "id": 1,
      "name": "Deterministic tax core",
      "gate": "All golden tests pass; engine coverage >= 95%; zero tax constants outside core/rules",
      "status": "in_progress"
    },
    {
      "id": 2,
      "name": "Demolition & de-faking",
      "gate": "No hardcoded slabs outside core/rules; semantic retrieval verified; p95 < 3s @ 20 concurrent",
      "status": "in_progress"
    },
    {
      "id": 3,
      "name": "Thin agents & orchestration",
      "gate": "Zero numeric_provenance failures; reviewer catches all seeded omissions; p95 < 4s single-pass informational and < 9s full three-pass review; scheduler jobs run with a real DB session",
      "status": "in_progress"
    },
    {
      "id": 4,
      "name": "Document intelligence",
      "gate": "Parsers fail loudly on malformed input; reconciliation zero false negatives on seeded set",
      "status": "in_progress"
    },
    {
      "id": 5,
      "name": "Planning features",
      "gate": "Golden tests per feature; every output line carries a citation",
      "status": "not_started"
    },
    {
      "id": 6,
      "name": "Procurement Intelligence",
      "gate": "EV worked example correct end-to-end; no Tier-3 source in any cost line; all figures dated",
      "status": "not_started"
    },
    {
      "id": 7,
      "name": "Production readiness",
      "gate": "Security checklist passed; DPDP controls table published; load test at target concurrency",
      "status": "not_started"
    }
  ],
  "features": [
    {
      "id": "FND-001",
      "name": "Repository hygiene",
      "phase": 0,
      "tier": "P0",
      "status": "verified",
      "description": "Remove .DS_Store, __pycache__, .pytest_cache, .ruff_cache, senv/ from the tree. Purge exports/ (40+ unencrypted user financial PDFs) and gitignore it.",
      "deterministic": true,
      "llm_involved": false,
      "depends_on": [],
      "acceptance_criteria": [
        "git status clean after fresh clone + install",
        "exports/ gitignored and emptied",
        "no build artefacts tracked or present"
      ],
      "files": [
        ".gitignore",
        "exports/"
      ],
      "tests": {
        "golden": [],
        "unit": [],
        "eval": []
      },
      "risk": "Low. Verify exports/ contains no data the user still needs before purge.",
      "last_verified": "2026-08-09"
    },
    {
      "id": "FND-002",
      "name": "feature.json registry + PROGRESS.md generator",
      "phase": 0,
      "tier": "P0",
      "status": "verified",
      "description": "Machine-readable feature registry as single source of truth. scripts/gen_progress.py renders PROGRESS.md. PROGRESS.md is never hand-edited.",
      "deterministic": true,
      "llm_involved": false,
      "depends_on": [],
      "acceptance_criteria": [
        "feature.json validates against docs/feature.schema.json",
        "gen_progress.py regenerates PROGRESS.md deterministically",
        "CI fails if PROGRESS.md differs from generated output"
      ],
      "files": [
        "feature.json",
        "docs/feature.schema.json",
        "scripts/gen_progress.py",
        "PROGRESS.md"
      ],
      "tests": {
        "golden": [],
        "unit": [
          "test_feature_registry_schema"
        ],
        "eval": []
      },
      "risk": "Low",
      "last_verified": "2026-08-09"
    },
    {
      "id": "FND-003",
      "name": "CI pipeline",
      "phase": 0,
      "tier": "P0",
      "status": "verified",
      "description": "GitHub Actions: ruff, mypy, pytest with coverage gate, import-linter, pip-audit, npm build + oxlint, PROGRESS.md drift check, verify_freshness.py.",
      "deterministic": true,
      "llm_involved": false,
      "depends_on": [
        "FND-002"
      ],
      "acceptance_criteria": [
        "All jobs run on PR and main",
        "Coverage gate enforced on backend/core at 95%",
        "Build fails on stale last_verified"
      ],
      "files": [
        ".github/workflows/ci.yml",
        "scripts/verify_freshness.py"
      ],
      "tests": {
        "golden": [],
        "unit": [],
        "eval": []
      },
      "risk": "Low",
      "last_verified": "2026-08-09"
    },
    {
      "id": "FND-004",
      "name": "Core purity boundary rule",
      "phase": 0,
      "tier": "P0",
      "status": "verified",
      "description": "import-linter contract: backend/core must not import backend.api, backend.agents, backend.db, groq, httpx, requests, or sqlalchemy. Guarantees the core is deterministic and exhaustively testable.",
      "deterministic": true,
      "llm_involved": false,
      "depends_on": [
        "FND-003"
      ],
      "acceptance_criteria": [
        "importlinter contract defined and passing",
        "CI fails on any violating import"
      ],
      "files": [
        ".importlinter",
        "setup.cfg"
      ],
      "tests": {
        "golden": [],
        "unit": [],
        "eval": []
      },
      "risk": "Low",
      "last_verified": "2026-08-09"
    },
    {
      "id": "FND-005",
      "name": "Dependency upgrade and audit",
      "phase": 0,
      "tier": "P0",
      "status": "verified",
      "description": "Upgrade fastapi/starlette/pydantic from ~2yr-old pins. Drop celery, rq (unused), python-jose (unmaintained, PyJWT already present), sentence-transformers==2.2.2 (broken against modern huggingface_hub). Verify frontend pins resolve.",
      "deterministic": true,
      "llm_involved": false,
      "depends_on": [
        "FND-003"
      ],
      "acceptance_criteria": [
        "pip-audit reports zero high/critical advisories",
        "npm ci resolves cleanly and npm run build passes",
        "requirements.txt contains no unused package"
      ],
      "files": [
        "requirements.txt",
        "pyproject.toml",
        "frontend/package.json"
      ],
      "tests": {
        "golden": [],
        "unit": [],
        "eval": []
      },
      "risk": "Medium. Pydantic and FastAPI majors may need code changes.",
      "last_verified": "2026-08-09"
    },
    {
      "id": "FND-006",
      "name": "Agent harness skeleton",
      "phase": 0,
      "tier": "P0",
      "status": "verified",
      "description": "Wire all four harness layers with empty suites: golden runner, Hypothesis property harness, eval runner with scorer plugin interface and fixture replay, contract/integration scaffolding.",
      "deterministic": true,
      "llm_involved": false,
      "depends_on": [
        "FND-003"
      ],
      "acceptance_criteria": [
        "pytest discovers all four layers",
        "eval runner replays from fixtures with zero network calls",
        "baseline.json comparison logic implemented"
      ],
      "files": [
        "backend/core/tests/golden/",
        "backend/evals/runner.py",
        "backend/evals/scorers/",
        "backend/evals/baseline.json"
      ],
      "tests": {
        "golden": [],
        "unit": [
          "test_eval_runner"
        ],
        "eval": []
      },
      "risk": "Low",
      "last_verified": "2026-08-09"
    },
    {
      "id": "CORE-001",
      "name": "Versioned tax rule packs",
      "phase": 1,
      "tier": "P0",
      "status": "verified",
      "description": "YAML rule packs per FY (2024-25, 2025-26, 2026-27) with meta.effective_from/to, governing_act, verified_on, sources. Loader returns an immutable TaxRuleset. Replaces seven divergent hardcoded copies.",
      "deterministic": true,
      "llm_involved": false,
      "depends_on": [
        "FND-004"
      ],
      "acceptance_criteria": [
        "load_ruleset(fy) returns immutable ruleset for all supported FYs",
        "Unknown FY raises explicitly, never falls back to a default",
        "Every rule node carries a source URL",
        "grep finds zero tax constants outside core/rules"
      ],
      "rules_refs": [
        "fy_2026_27",
        "fy_2025_26",
        "fy_2024_25"
      ],
      "legal_refs": [
        {
          "act": "Income-tax Act, 2025",
          "note": "FY 2026-27 onward"
        }
      ],
      "sources": [
        "https://www.incometax.gov.in/",
        "https://www.incometaxindia.gov.in/"
      ],
      "files": [
        "backend/core/rules/"
      ],
      "tests": {
        "golden": [
          "ruleset_load"
        ],
        "unit": [
          "test_ruleset_immutable",
          "test_unknown_fy_raises"
        ],
        "eval": []
      },